source,sentence,cause_start,cause_end,effect_start,effect_end
MedCaus, Rehabilitation services may also aid the patient so that patients may use their vision in a more effective manner .,1.0,49.0,58.0,114.0
MedCaus," As they run along , the parallel fibers pass through the dendritic trees of Purkinje cells , contacting one of every 3 ` Äì5 that they pass , making a total of 80 ` Äì100 synaptic connections with Purkinje cell dendritic spines . ''",1.0,12.0,19.0,85.0
MedCaus, Competitive inhibition : Some drugs may share the same P-450 specificity and thus competitively block their bio transformation .,1.0,73.0,83.0,127.0
MedCaus," In some cases , the inhibitor can bind to a site other than the binding - site of the usual substrate and exert an allosteric effect to change the shape of the usual binding - site . ''",15.0,126.0,134.0,176.0
MedCaus," so they would be hired again , adding that , if it happened , she would dance in front of the car in a bikini . ''",44.0,51.0,61.0,103.0
MedCaus, There are two systems that create a hyperosmotic medulla and thus increase the body plasma volume : Urea recycling and the ' single effect . ',11.0,57.0,67.0,98.0
MedCaus," The H1 and H4 receptors are thought to increase permeability in the blood - brain barrier , thus increasing infiltration of unwanted cells in the central nervous system .",1.0,90.0,98.0,169.0
MedCaus," Quantities in decibels are not necessarily additive , thus being '' '' of unacceptable form for use in dimensional analysis '' '' . ''",1.0,43.0,55.0,115.0
MedCaus," Mixed nerves contain both afferent and efferent axons , and thus conduct both incoming sensory information and outgoing muscle commands in the same bundle .",1.0,54.0,66.0,155.0
MedCaus," A Shirodkar cerclage is very similar , but the sutures pass through the walls of the cervix so they 're not exposed .",44.0,92.0,96.0,116.0
MedCaus," Bha · π ≠ · π ≠ ƒÅrakas , who head institutions , are technically junior monks , and thus permitted to stay in the same place .",1.0,30.0,51.0,90.0
MedCaus, It is typically used when the frog has been grabbed by a predator and may serve to distract or disorientate the attacker so that it releases the frog .,81.0,121.0,130.0,150.0
MedCaus," If the effect develops more slowly , the predator may learn to avoid that species in future .",4.0,35.0,55.0,92.0
MedCaus," This form of touch therapy breaks down tissue tensions , and restores normal lengths to the tendons , thus reducing stress . ''",56.0,92.0,103.0,116.0
MedCaus," He built a Crookes tube with a '' '' window '' '' in the end made of thin aluminum , facing the cathode so the cathode rays would strike it -LRB- later called a '' '' Lenard tube '' '' -RRB- . ''",1.0,85.0,93.0,124.0
MedCaus," The plants are grown close together , and then joined so that each plant has roots below and growth above the point of union . ''",37.0,47.0,58.0,119.0
MedCaus, Not only this prototype was later totally destroyed but each surviving composition is battered so it is necessary to move from church to church to reconstruct the system .,1.0,95.0,99.0,170.0
MedCaus, Freeman wanted to simplify the procedure so that it could be carried out by psychiatrists in psychiatric hospitals .,1.0,41.0,50.0,115.0
MedCaus," Extraversion and introversion are typically viewed as a single continuum , so to be high in one necessitates being low in the other .",1.0,73.0,79.0,132.0
MedCaus," Finally , along transportation corridors , large shelters , called snow sheds , can be built directly in the slide path of an avalanche to protect traffic from avalanches . ''",9.0,126.0,137.0,160.0
MedCaus," In severe cases , where dehydration develops , intravenous fluid may be required . ''",1.0,36.0,46.0,72.0
MedCaus," The amount of radiation emitted by an object increases with temperature ; therefore , thermography allows one to see variations in temperature . ''",1.0,60.0,85.0,131.0
MedCaus," They were in comfortable circumstances but not wealthy enough to live in downtown Buenos Aires so the family resided in Palermo , then a poorer suburb . ''",1.0,89.0,96.0,120.0
MedCaus," The curvature of the back decreases height , thus putting pressure on internal organs , wearing them out more quickly than the natural aging process ; surgical procedures are almost always recommended in this case . ''",1.0,36.0,87.0,141.0
MedCaus," Second , AVP constricts arterioles , which increases peripheral vascular resistance and raises arterial blood pressure . ''",8.0,24.0,38.0,110.0
MedCaus," The vas deferens is derived from the mesonephric duct , a structure that develops from mesoderm . ''",29.0,49.0,1.0,8.0
MedCaus, The exchange was part of the terms of the Treaty of Lausanne which ended the war .,1.0,13.0,68.0,81.0
MedCaus," In some brands , the expectorate is stained , so that one can see the bacteria and debris .",18.0,44.0,55.0,90.0
MedCaus," Others , including the Vilna Gaon , have the understanding that the Talmud 's timeframe for dawn was referring specifically to an equinox day in Mesopotamia , and is therefore teaching that dawn should be calculated daily as commencing when the sun is 16.1 degrees below the horizon . ''",8.0,163.0,167.0,275.0
MedCaus," As the pressure of the gases within the body increases , fluids are forced to escape from natural orifices , such as the nose , mouth , and anus , and enter the surrounding environment .",4.0,55.0,58.0,107.0
MedCaus," Using genetic markers in ribosomal DNA , the researchers developed PCR assays to selectively amplify O. bifurcum DNA from human fecal samples . ''",1.0,35.0,40.0,134.0
MedCaus," Color microform is extremely expensive , thus discouraging most libraries supplying color films . ''",1.0,29.0,42.0,90.0
MedCaus," However , once gangrene has developed , the affected tissues are not salvageable . ''",11.0,28.0,39.0,69.0
MedCaus," Their interest encouraged him to publish his notes , Of Colours , which he later expanded into the work Opticks .",1.0,15.0,34.0,51.0
MedCaus," In the liver , large areas of the tissues are formed but for the formation of new cells there must be sufficient amount of material so the circulation of the blood becomes more active .",58.0,132.0,136.0,184.0
MedCaus," The idea is thought to in part be sparked by quantum theory , in that , energy and matter are from the same reality , therefore , all psychological problems involve a dysregulated or imbalanced energy system . ''",71.0,108.0,129.0,201.0
MedCaus," The fantasy genre developed from mythological , fairy tale , and Romance motifs and characters , sometimes with anthropomorphic animals .",34.0,136.0,1.0,18.0
MedCaus," Although a blanket bog is more common on acidic substrates , under some conditions it may also develop on neutral or even alkaline ones , if abundant acidic rainwater predominates over the groundwater . ''",139.0,189.0,60.0,131.0
MedCaus," The incineration of the wick limits the exposed length of the wick , thus maintaining a constant burning temperature and rate of fuel consumption . ''",1.0,62.0,70.0,134.0
MedCaus," The scion is similarly sliced through at an equal angle starting just below a bud , so that the bud is at the top of the cut and on the other side than the cut face . ''",1.0,78.0,88.0,160.0
MedCaus," This was known as the '' '' lysine contingency '' '' and was supposed to prevent the cloned dinosaurs from surviving outside the park , forcing them to be dependent on lysine supplements provided by the park 's veterinary staff . ''",16.0,35.0,130.0,208.0
MedCaus, The great 18th - century authority Rabbi Yechezkel Landau after a study concluded although '' '' hunting would not be considered cruelty to animals insofar as the animal is generally killed quickly and not tortured ... '',149.0,202.0,92.0,140.0
MedCaus, Their purpose in the game is expanded to a greater level of detail if the player is able to attain an '' '' A '' '' as his final score . '',68.0,119.0,1.0,60.0
MedCaus," The magnetic field in the solar corona must undergo nearly constant reconnection to match the motion of this '' '' magnetic carpet '' '' , so the energy released by the reconnection is a natural candidate for the coronal heat , perhaps as a series of '' '' microflares '' '' that individually provide very little energy but together account for the required energy . ''",1.0,124.0,135.0,209.0
MedCaus, It has also been seen that the four million tourists that visit the country yearly will be tripled once the airport project proposal pushes through .,105.0,148.0,28.0,99.0
MedCaus," Smell impulses are faster than other sensory stimuli such as visual and auditory processing , and thus has a powerful effect on one ` Äôs emotional state . ''",1.0,81.0,133.0,148.0
MedCaus," The projections of the dorsal raphe have been found to vary topographically , and thus the subnuclei differ in their projections .",1.0,76.0,88.0,129.0
MedCaus, It is released in response to stress and low blood - glucose concentration .,54.0,75.0,1.0,15.0
MedCaus," A charge is placed on the ring based immediately prior to fluorescence intensity being measured , and the opposite charge is trapped on the droplet as it breaks from the stream . ''",149.0,170.0,99.0,140.0
MedCaus," The ganglion cells , whose axons form the optic nerve , are at the front of the retina ; therefore the optic nerve must cross through the retina en route to the brain .",1.0,87.0,100.0,167.0
MedCaus," The ring canal has several small stone canals , located between the arms of the animal , but these open into the body cavity , and thus are only indirectly connected to the outside . ''",88.0,118.0,132.0,173.0
MedCaus," The rowan or mountain ash fruit must be bletted and cooked to be edible , to break down the toxic parasorbic acid -LRB- hexenollactone -RRB- into sorbic acid .",78.0,158.0,1.0,72.0
MedCaus, They proposed instead that a comprehensive regime to protect the Antarctic environment be negotiated in its place .,1.0,50.0,54.0,114.0
MedCaus," The bud in the axil of each thorn - leaf then develops a short shoot with several normal , photosynthetic leaves . ''",1.0,36.0,47.0,106.0
MedCaus," The name is a reference to the defining feature of the group , which is the modification of the ovipositor into a stinger -LRB- thus , the group could be called '' '' stinging wasps '' '' , though the group also contains the ants and the bees -RRB- . ''",64.0,114.0,162.0,167.0
MedCaus, In a 2006 interview he said that Mika was one of the few reasons he would have the implants taken out .,34.0,38.0,66.0,102.0
MedCaus," When the left ventricle contracts , the pressure in the ventricle forces the valve to close , while the tendons keep the leaflets coapting together and prevent the valve from opening in the wrong direction -LRB- thus preventing blood to flow back to the left atrium -RRB- .",37.0,66.0,74.0,92.0
MedCaus, Acharya is one of the Pa √ ± ca - Parame · π £ · π ≠ hi -LRB- five supreme beings -RRB- and thus worthy of worship .,1.0,45.0,50.0,56.0
MedCaus," In April 1997 , he scored twice against Liverpool in a match billed the '' '' title decider '' '' which ended in a 3 ` Äì1 United win at Anfield . ''",15.0,55.0,99.0,119.0
MedCaus," As of 2017 most center pivot systems have drops hanging from a U - shaped pipe attached at the top of the pipe with sprinkler heads that are positioned a few feet -LRB- at most -RRB- above the crop , thus limiting evaporative losses . ''",38.0,126.0,201.0,226.0
MedCaus," To do that , we need to perform the relevant integration by substitution : thus , we need to multiply by the derivative of the -LRB- natural -RRB- logarithm function , which is 1/y . ''",12.0,60.0,167.0,174.0
MedCaus," Acetylcholine hyperpolarizes the sinoatrial node , which is overcome by MRA and thus increases the heart rate .",1.0,76.0,86.0,110.0
MedCaus," Discovering that motor axons have both a lower rheobase and a longer strength - duration time constant in ALS has prompted the conclusion that motor neurons are abnormally excitable in ALS , with properties more like those of sensory neurons .",1.0,110.0,124.0,242.0
MedCaus, The classic example is Jenner 's use of cowpox to protect against smallpox .,24.0,47.0,48.0,75.0
MedCaus, Symptoms may also be precipitated by alcoholism and the use of antidepressants .,1.0,34.0,38.0,79.0
MedCaus," For the study , the researchers injected pregnant mice with AMH so that they had a higher than normal concentration of the hormone . ''",15.0,60.0,68.0,123.0
MedCaus," Most trains take 250 ` Äì400 trucks off the road , thus making the road more safe . ''",1.0,36.0,45.0,67.0
MedCaus," In Heart of the Swarm , he guides Kerrigan to Zerus , the original home of the Zerg , and encourages her to re - infest herself so she can stop Amon , a fallen Xel ` naga who is revealed to be the master of Duran and seeks to destroy all life in the Korpulu Sector and remold it in his image . ''",23.0,120.0,129.0,144.0
MedCaus," Mendicant orders that had real estate were less economically integrated , so that some individual houses were wealthy while others struggled economically .",1.0,72.0,83.0,154.0
MedCaus," There he achieved his habilitation , or Venia Legendi , a postdoctoral qualification common to many European academic systems that entitles the holder to supervise doctoral candidates and is thus essential for an academic career .",57.0,184.0,197.0,229.0
MedCaus," In Thompson 's The Historicity of the Patriarchal Narratives , he suggests that the patriarchal narratives arose in a response to some present situation , expressed as an imaginative picture of the past to embody present hope .",131.0,153.0,81.0,113.0
MedCaus," In addition , increased glycosylation of hemoglobin increases its affinity for oxygen , therefore preventing its release at the tissue and inducing a level of hypoxia in extreme cases . ''",13.0,79.0,136.0,178.0
MedCaus," In some cases , Poison ivy may entirely engulf the supporting structure , and vines may extend outward like limbs , so that it appears to be a Poison ivy '' '' tree '' '' . ''",15.0,108.0,117.0,160.0
MedCaus," If one has friends or peers who engage in drug use favorably , the chances of them developing an addiction increases . ''",1.0,51.0,62.0,107.0
MedCaus," Inhalation of fungal spores or localized colonization of the skin may initiate persistent infections ; therefore , mycoses often start in the lungs or on the skin . ''",1.0,90.0,114.0,158.0
MedCaus," It is implied throughout the film that Rumpelstiltskin 's deals have fallen out of favour in Shrek 's world as people have learned to be more comfortable with who they are thanks to Shrek 's example -LRB- such as Pinocchio rejecting the offer to become a real boy -RRB- , and Shrek 's friend Donkey also mentions that Rumpelstiltskin has changed the clauses in his deals as now everybody knows his name . ''",109.0,168.0,1.0,102.0
MedCaus, It is released from the pancreas in response to the hormone secretin to neutralize the acidic chyme entering the duodenum from the stomach .,49.0,139.0,1.0,36.0
MedCaus, The study of great apes in their own environment and in captivity has changed attitudes to anthropomorphism .,1.0,66.0,79.0,108.0
MedCaus, He continually improved his apparatus to make it more sensitive and to reduce the time lag between the heat released by the preparation and its recording by his thermocouple .,1.0,38.0,47.0,174.0
MedCaus, TSP-1 levels are known to increase in response to injury and during development .,51.0,80.0,1.0,35.0
MedCaus, Its planar conformation would be antiaromatic and is thus disfavoured .,34.0,46.0,59.0,70.0
MedCaus," The imperial fluid ounce , on the other hand , is only 4 % smaller than the US fluid ounce and therefore they are often used interchangeably .",1.0,91.0,106.0,141.0
MedCaus," The shift encourages oxygen to bind to the three remaining heme units within hemoglobin -LRB- thus , oxygen binding is cooperative -RRB- . ''",1.0,77.0,100.0,119.0
MedCaus," Although many biochemicals are colored , as in , they absorb visible light and therefore can be measured by colorimetric procedures , even colorless biochemicals can often be converted to colored compounds suitable for chromogenic color - forming reactions to yield compounds suitable for colorimetric analysis . ''",50.0,69.0,80.0,121.0
MedCaus," In 1947 , the Freeman and Watts partnership ended , as the latter was disgusted by Freeman 's modification of the lobotomy from a surgical operation into a simple '' '' office '' '' procedure . ''",53.0,176.0,1.0,44.0
MedCaus," The nucleous of these cells , however , are disposed at different levels , thus creating the illusion of cellular stratification . ''",1.0,22.0,76.0,114.0
MedCaus," Family members , teachers , and friends should be informed about EDSs so they can accept and assist the child . ''",1.0,65.0,71.0,104.0
MedCaus, Exercise could exacerbate ketoacidosis by increasing ketone synthesis in response to increased circulating NEFA 's .,1.0,9.0,27.0,39.0
MedCaus, It also makes blood vessels more permeable so neutrophils and clotting proteins can get into connective tissue more easily .,1.0,43.0,47.0,123.0
MedCaus, The fibroblasts within the granulation tissue develop into chondroblasts which also form hyaline cartilage .,1.0,73.0,85.0,107.0
MedCaus," Sarcomas , therefore , represent about 1 % of the 1.5 million new cancer diagnoses in that country each year . ''",1.0,0.0,22.0,104.0
MedCaus," When thus excited by light , the photoceptor sends a proportional response synaptically to bipolar cells which in turn signal the retinal ganglion cells .",11.0,27.0,30.0,153.0
MedCaus," Apollo promises to protect Orestes , as Orestes has become Apollo 's supplicant . ''",38.0,69.0,1.0,27.0
MedCaus," When the embryo is adequately developed it hatches , i.e. ''",1.0,30.0,31.0,43.0
MedCaus, American rootstocks had trouble adapting to the high soil pH value of some regions in France so the final solution to the pandemic was to hybridize the American and French variants .,1.0,93.0,97.0,181.0
MedCaus," The move garnered severe criticism from users , prompting Instagram CEO Kevin Systrom to write a blog post one day later , announcing that they would '' '' remove '' '' the offending language from the policy . ''",1.0,40.0,47.0,192.0
MedCaus, The vacuole contains high concentrations of nitrate ions and is therefore thought to be a storage organelle .,1.0,57.0,75.0,108.0
MedCaus, Patients with APECED develop an autoimmune disease that affects multiple endocrine tissues .,30.0,51.0,65.0,91.0
MedCaus," This reduces the amount of X - rays reaching the detector in the shadow of the bones , making them clearly visible on the radiograph .",1.0,85.0,100.0,133.0
MedCaus," Solutrean backed edge blades display pronounced and abrupt retouching , so that they are long and narrow and , although rare , characterize certain phases of the Solutrean period .",1.0,70.0,81.0,105.0
MedCaus, Most of what has been detailed in Hemichordate development has come from hemichordates that develop directly .,74.0,109.0,1.0,59.0
MedCaus, Successful models were developed to explain the interiors of stars and stellar evolution .,1.0,33.0,37.0,89.0
MedCaus," The color of its aqueous solution varies from green to orange as a function of the way it is observed : by reflection or by transmission , as can be noticed in bubble levels , for example , in which fluorescein is added as a colorant to the alcohol filling the tube in order to increase the visibility of the air bubble contained within -LRB- thus enhancing the precision of the instrument -RRB- . ''",194.0,330.0,344.0,379.0
MedCaus," However , no studies have lasted this long , so the lifespan may be longer .",11.0,43.0,49.0,75.0
MedCaus," Starch gelatinization is a process of breaking down the intermolecular bonds of starch molecules in the presence of water and heat , allowing the hydrogen bonding sites -LRB- the hydroxyl hydrogen and oxygen -RRB- to engage more water .",1.0,22.0,143.0,235.0
MedCaus, The pancreas develops from these buds on either side of the duodenum .,28.0,69.0,1.0,13.0
MedCaus, '' Closed and '' '' open '' '' mitosis can be distinguished on the basis of nuclear envelope remaining intact or breaking down . '',74.0,122.0,1.0,46.0
MedCaus," Low mass stars -LRB- including the Sun -RRB- , with a mass between 0.5 M ` òâ and 1.8 ` Äì2 .5 M ` òâ depending on composition , do become red giants as their core hydrogen is depleted and they begin to burn helium in core in a helium flash ; they develop a degenerate carbon - oxygen core later on the asymptotic giant branch ; they finally blow off their outer shell as a planetary nebula and leave behind their core in the form of a white dwarf . ''",128.0,150.0,98.0,115.0
MedCaus, The cats fed the all - raw diet were healthy while the cats fed the cooked meat diet developed various health problems .,52.0,85.0,86.0,119.0
MedCaus," Hagfishes lack a true vertebral column , and are therefore not properly considered vertebrates , but a few tiny neural arches are present in the tail .",1.0,39.0,60.0,95.0
MedCaus, This procedure widens a fold in the peritoneum so that the intestines can be placed in non - rotated formation .,1.0,47.0,51.0,111.0
MedCaus," It was written c. 175 to 177 , shortly after the death of Justin Martyr -LRB- who was possibly the first Christian apologist -RRB- , and was probably a response to his work . ''",162.0,168.0,132.0,150.0
MedCaus," To avoid that problem , Griffith developed a thermodynamic approach to explain the relation that he observed . ''",23.0,59.0,69.0,100.0
MedCaus," One of the effects of this directive was that the United Kingdom amended its own legislation to replace the gallon with the litre as a primary unit of measure in trade and in the conduct of public business , effective from 30 September 1995 .",23.0,37.0,38.0,206.0
MedCaus," In addition , immunological tolerance may develop against tumor antigens , so the immune system no longer attacks the tumor cells . ''",13.0,73.0,76.0,124.0
MedCaus," During the final assault against Korhal , Valerian recognized that Arcturus was beyond redemption , and asked only that Kerrigan minimize civilian casualties ; Kerrigan thus elected to attend his request , recognizing him as a different man from his father . ''",41.0,147.0,170.0,196.0
MedCaus, It is conjectured that a progressive decline in hormone levels with age is partially responsible for weakened immune responses in aging individuals .,1.0,85.0,102.0,148.0
MedCaus," Normally , these people are sentenced to a certain punishment so they can reflect and realize their sins . ''",10.0,51.0,63.0,100.0
MedCaus, Bioventing is a process that increases the oxygen or air flow into the unsaturated zone of the soil which increases the rate of natural in situ degradation of the targeted hydrocarbon contaminant .,1.0,100.0,107.0,196.0
MedCaus," Vaccines are being developed to defend against bioterrorist attacks such as anthrax , plague , and smallpox . ''",1.0,0.0,30.0,99.0
MedCaus," When bone marrow develops , it eventually assumes the task of forming most of the blood cells for the entire organism . ''",1.0,17.0,32.0,109.0
MedCaus, This increase in water volume in the cytoplasm forces the coiled cnidae tubule to eject rapidly .,1.0,47.0,48.0,96.0
MedCaus," Skin conductance , therefore , offers direct insights into autonomous emotional regulation . ''",1.0,5.0,30.0,80.0
MedCaus," In front of the buccopharyngeal area , where the lateral crescents of mesoderm fuse in the middle line , the pericardium is afterward developed , and this region is therefore designated the pericardial area .",106.0,144.0,176.0,207.0
MedCaus, Some cultures used lime - based cement for the plaster to protect against rain damage .,1.0,55.0,59.0,86.0
MedCaus," Texas thus became an independent country with its own president , congress , and monetary system . ''",1.0,0.0,7.0,90.0
MedCaus," When the floor of the mouth is compressed , air is forced into the lungs . ''",1.0,31.0,49.0,67.0
MedCaus," Using Carl Auer von Welsbach 's flint , companies like Ronson were able to develop practical and easy to use lighters . ''",1.0,32.0,39.0,109.0
MedCaus," Also , the IMRT technology has only been used commercially since the late 1990s even at the most advanced cancer centers , so radiation oncologists who did not learn it as part of their residency programs must find additional sources of education before implementing IMRT .",8.0,121.0,127.0,272.0
MedCaus," Varying the amount of carbon and many other alloying elements , as well as controlling their chemical and physical makeup in the final steel -LRB- either as solute elements , or as precipitated phases -RRB- , slows the movement of those dislocations that make pure iron ductile , and thus controls and enhances its qualities .",1.0,278.0,290.0,325.0
MedCaus," This allowed the removal of fluids , by applying a negative pressure to the outside canister , thus making it the first truly practical device for hemodialysis . ''",36.0,84.0,96.0,147.0
MedCaus, A single molecule of uric acid can remove four atoms of nitrogen making uricotelism more efficient than ammonotelism or ureotelism .,1.0,65.0,73.0,131.0
MedCaus, The recipient is immuno - compromised and therefore can not destroy or inactivate the transplanted cells .,1.0,38.0,53.0,105.0
MedCaus, They may also change the lining of the uterus and thus decrease implantation .,1.0,46.0,56.0,77.0
MedCaus, Its resistance to wear and tarnish is well suited to use in fine jewellery .,1.0,50.0,54.0,75.0
MedCaus, Education of families is critical in developing strategies for understanding strengths and weaknesses ; helping the family to cope improves outcomes in children .,105.0,131.0,141.0,161.0
