source,sentence,cause_start,cause_end,effect_start,effect_end
MedCaus," With advances in micromachinery and easy - to - use microcontroller platforms , the uses of sensors have expanded beyond the traditional fields of temperature , pressure or flow measurement , for example into MARG sensors . ''",1.0,68.0,79.0,178.0
MedCaus," In contrast , autoimmunity is an immune response to the self 's own antigens . ''",50.0,68.0,13.0,33.0
MedCaus," For instance , men and women alike are capable of classifying sex acts as sexual no matter if they find them appealing or not , making a genital response to unappealing erotic stimuli a single mechanism step . ''",14.0,122.0,127.0,203.0
MedCaus," The criminological theory of relative deprivation explains that people who feel jealous and discontent , therefore might turn to crime to get the things that they ca n't afford but others have . ''",60.0,92.0,106.0,188.0
MedCaus," This reduces the amount of skin exposed to the air or a dry surface , and thus reduces water loss .",1.0,68.0,80.0,98.0
MedCaus," Nevertheless , phages of Inoviridae have been shown to complicate biofilms involved in pneumonia and cystic fibrosis and shelter the bacteria from drugs meant to eradicate disease , thus promote persistent infection . ''",14.0,172.0,183.0,206.0
MedCaus," The term was coined by Karen L. Fingerman and further developed by Melinda Blau , who collaborated with the psychologist to explore and popularize the concept . ''",122.0,151.0,81.0,108.0
MedCaus," They are external to his senses , and according to Descartes , this is evidence of the existence of something outside of his mind , and thus , an external world . ''",62.0,125.0,142.0,155.0
MedCaus," With involvement by foreign troops , the war ended in a stalemate in 1953 , but without a formalized peace treaty .",6.0,35.0,38.0,74.0
MedCaus, With this transition certain social interactions with friend and family may be limited forcing the individual to look else where for these social interactions .,1.0,87.0,114.0,159.0
MedCaus, This damage response involves the proteolysis of type XVII collagen by neutrophil elastase in response to the DNA damage in the hair follicle stem cells .,107.0,153.0,1.0,94.0
MedCaus," Affects high in motivational intensity , thus , narrow cognitive scope making people able to focus more on central information .",1.0,39.0,49.0,127.0
MedCaus," If the sheet were to break down , ocean levels would rise by several metres in a relatively geologically short period of time , perhaps a matter of centuries . ''",1.0,27.0,33.0,121.0
MedCaus," The Bema was celebrated at the vernal equinox , was preceded by fasts , and symbolized the passion of Mani , thus it was strictly parallel to the Christian Easter . ''",1.0,102.0,110.0,156.0
MedCaus," Phosphorylated CREB translocates into the nucleus and mediates increased expression of anti - apoptotic proteins , thus promoting NGF - mediated cell survival . ''",1.0,104.0,116.0,150.0
MedCaus, Cork it tightly so that the activity is not dissipated .,1.0,16.0,25.0,55.0
MedCaus, The conflict is only ended when Tassadar demonstrates the effectiveness of the dark templar against the Zerg .,33.0,109.0,1.0,27.0
MedCaus," However , after the war he changed to a pro - Turkish position , accusing Greece 's military government in occupied Turkish territory of atrocities and massacres . ''",9.0,54.0,64.0,152.0
MedCaus," Centuries of constant warfare on the Armenian Plateau forced many Armenians , including those in the Karabakh region , to emigrate and settle elsewhere . ''",77.0,110.0,120.0,142.0
MedCaus," Over a long period of lithium treatment , cyclic AMP and adenylate cyclase levels are further changed by gene transcription factors . ''",103.0,124.0,41.0,102.0
MedCaus, Van Zoelen wanted to sell to Philips so that HDD would have sufficient financial backing when their major competitors returned after the war .,1.0,37.0,46.0,141.0
MedCaus," As it is an intrinsic property of the nervous system , it can not be changed through voluntary control , exercise , or diet . ''",1.0,46.0,115.0,119.0
MedCaus," The ancient Greek physician Galen -LRB- prominent among the Romans -RRB- mentioned asparagus as a beneficial herb during the second century AD , but after the Roman empire ended , asparagus drew little medieval attention .",156.0,178.0,181.0,221.0
MedCaus," It induces directed polymerization of actin by the ActA transmembrane protein , thus pushing the bacterial cell around . ''",1.0,70.0,81.0,112.0
MedCaus, TNS forms covalent bonds with chymotrypsinogen and as the bonds break to from chymotrypsin in the presence of trypsin the fluorescence increases .,55.0,118.0,119.0,145.0
MedCaus," He could moreover prove that such a wave would necessarily travel at the speed of light , and thus light itself was a form of electromagnetic radiation . ''",25.0,82.0,95.0,142.0
MedCaus," Most dentists therefore prefer to keep dental treatment in people with bruxism very simple and only carry it out when essential , since any dental work is likely to fail in the long term . ''",129.0,182.0,15.0,118.0
MedCaus," Degrees of internal intussusception have been demonstrated in 40 % of asymptomatic subjects , raising the possibility that it represents a normal variant in some , and may predispose patients to develop symptoms , or exacerbate other problems . ''",93.0,183.0,193.0,203.0
MedCaus," The supplies tend to be expensive , since the sensors must be changed at least weekly . ''",1.0,24.0,37.0,79.0
MedCaus," Instead , detailed photos and measurements are taken of the animal so a taxidermist can create an exact replica in resin or fiberglass that can be displayed in place of the real animal . ''",9.0,60.0,68.0,178.0
MedCaus," Though a judge halted Litten 's questioning , thus saving Hitler from further damning exposure , newspapers at the time reported on the trial in detail and Hitler was investigated for perjury that summer . ''",1.0,32.0,47.0,86.0
MedCaus," The technique of discus throwing is quite difficult to master and needs lots of experience to get right , thus most top throwers are 30 years old or more . ''",1.0,98.0,107.0,149.0
MedCaus," There are strict regulations on aircraft emissions of pollutants like carbon dioxide and nitrogen oxides , so combustors need to be designed to minimize those emissions . ''",1.0,98.0,108.0,159.0
MedCaus, Oxygen as a byproduct is of no further use to the reaction and thus released into the atmosphere .,1.0,59.0,69.0,97.0
MedCaus," This changes the surface chemistry and therefore surface energy of the material which affects the adhesion , biocompatibility , chemical inertness , lubricity , and sterilization of the material .",1.0,35.0,50.0,80.0
MedCaus," By moving the eye so that small parts of a scene can be sensed with greater resolution , body resources can be used more efficiently . ''",1.0,76.0,88.0,121.0
MedCaus," For instance , infection of Pseudomonas aeruginosa by the temperate phage PaP3 changed the expression of 38 % -LRB- 2160/5633 -RRB- of its host 's genes . ''",14.0,74.0,75.0,147.0
MedCaus," While the stimulating effects may last for hours , the euphoric sensation is very brief , prompting the user to smoke more immediately . ''",50.0,82.0,89.0,104.0
MedCaus," Between 1998 and 2001 , the city 's financial services sector grew at a rate of 30 % , making considerable gains on Edinburgh , which has historically been the centre of the Scottish financial sector .",25.0,85.0,95.0,126.0
MedCaus, Birth control also improves child survival in the developing world by lengthening the time between pregnancies .,1.0,67.0,71.0,111.0
MedCaus," In the 1970s , considerable effort was put towards the developing field of euphenics since it was seen as a positive form of genetic engineering . ''",86.0,133.0,14.0,75.0
MedCaus, The ability of some bivalves to burrow and thus avoid predators may have been a major factor in their success .,1.0,39.0,49.0,110.0
MedCaus," These booths render a 3-D model of the user , allowing the consumers to view different outfits on themselves without the need of physically changing clothes . ''",1.0,39.0,45.0,149.0
MedCaus," For example , during periods of exertion the body rapidly breaks down stored carbohydrates and fat , releasing CO2 into the blood stream . ''",13.0,95.0,100.0,130.0
MedCaus, Shields are also sometimes mounted on vehicle - mounted weapons to protect the operator .,68.0,88.0,1.0,64.0
MedCaus," Work on '' '' Skilled Memory and Expertise '' '' by Anders Ericsson and James J. Staszewski confronts the paradox of expertise and claims that people not only acquire content knowledge as they practice cognitive skills , they also develop mechanisms that enable them to use a large and familiar knowledge base efficiently . ''",168.0,193.0,144.0,159.0
MedCaus," When using drip lines , the leaching is best done regularly at certain intervals -LRB- with only a slight excess of water -RRB- , so that the salt is flushed back under the plant 's roots . ''",23.0,71.0,134.0,182.0
MedCaus, Other effects of alcohol on antibiotic activity include altered activity of the liver enzymes that break down the antibiotic compound .,18.0,48.0,57.0,134.0
MedCaus," In response to an EDF suit , the U.S. District Court of Appeals in 1971 ordered the EPA to begin the de - registration procedure for DDT .",16.0,27.0,30.0,137.0
MedCaus," However , this method which kept music away from polyphony , along with centuries of continuous culture , enabled monophonic music to develop to the greatest heights of perfection .",11.0,59.0,115.0,180.0
MedCaus," Nevertheless , Newton managed to avoid it by means of a special permission from Charles II .",55.0,91.0,16.0,42.0
MedCaus," The periosteal cells proximal to -LRB- on the near side of -RRB- the fracture gap develop into chondroblasts , which form hyaline cartilage . ''",1.0,95.0,112.0,130.0
MedCaus, Retinoids can act on retinoid nuclear receptors and thus regulate transcription .,1.0,48.0,58.0,80.0
MedCaus," Contamination layers are usually limited to a monolayer or less of atoms and are thus only detectable by surface analysis techniques , such as XPS .",1.0,73.0,87.0,147.0
MedCaus," The development of the chemistry of alkaloids was accelerated by the emergence of spectroscopic and chromatographic methods in the 20th century , so that by 2008 more than 12,000 alkaloids had been identified .",1.0,144.0,155.0,209.0
MedCaus," Vitamin C aids in the body 's ability to absorb iron , so taking oral iron supplements with orange juice is of benefit . ''",1.0,48.0,56.0,111.0
MedCaus, Borges uses the recurring image of '' '' a labyrinth that folds back upon itself in infinite regression '' '' so we '' '' become aware of all the possible choices we might make . '' '' '',36.0,84.0,111.0,155.0
MedCaus," This may also have a role in rheumatoid - arthritis pain ; cell potassium is always low in RA.Ascorbic acid presence , particularly in high doses has also been shown to mediate response to psychological stress and speed the decrease of the levels of circulating cortisol in the body post stress . ''",1.0,0.0,41.0,52.0
MedCaus," To explain why these stars exerted no net gravitational pull on the Solar System , Isaac Newton suggested that the stars were equally distributed in every direction , an idea prompted by the theologian Richard Bentley . ''",82.0,155.0,1.0,74.0
MedCaus," However , in response to the growing number of Wiccan temples and churches , several denominations of the religion have begun to develop a core group of ordained priestesses and priests serving a larger laity . ''",23.0,66.0,76.0,203.0
MedCaus," When women were given the forced - choice design in the study , they chose funny men as potential relationship partners even though they rated them as being less honest and intelligent . ''",1.0,56.0,63.0,173.0
MedCaus," The cleaved SNAP-25 is unable to mediate fusion of vesicles with the host cell membrane , thus preventing the release of the neurotransmitter acetylcholine from axon endings . ''",1.0,79.0,91.0,166.0
MedCaus," However , most retirement calculators use nominal -LRB- not '' '' real '' '' dollars -RRB- and therefore require a projection of both the expected inflation rate and the expected nominal rate of return . ''",9.0,74.0,86.0,187.0
MedCaus, Mastic varnish was used to protect and preserve photographic negatives .,1.0,24.0,28.0,71.0
MedCaus, Moose are thus attracted to marshes and river banks during warmer months as both provide suitable vegetation to eat and water to wet themselves in .,77.0,147.0,1.0,73.0
MedCaus," are less certain of their status , they are less willing to end the game . ''",1.0,26.0,34.0,68.0
MedCaus," Occasionally , a timpanist is forced to place a drum behind other items , so he can not reach it with his foot . ''",14.0,66.0,75.0,106.0
MedCaus, Several schemes and ideas have been developed to reduce the number of NEETs .,1.0,46.0,50.0,76.0
MedCaus, The cars would allow for rapid X - ray imaging of wounded soldiers so battlefield surgeons could quickly and more accurately operate .,36.0,67.0,71.0,133.0
MedCaus," If one has friends or peers who engage in drug use favorably , the chances of them developing an addiction increases . ''",20.0,51.0,62.0,107.0
MedCaus," UVA-1 , a more specific wavelength of UVA light , is able to penetrate the deeper portions of the skin and thus , thought to soften the plaques in morphea by acting in two fashions : -LSB- 1 -RSB- ''",49.0,103.0,113.0,172.0
MedCaus," A thiazide diuretic , such as chlorthalidone or hydrochlorothiazide , can be used to create mild hypovolemia which encourages salt and water uptake in proximal tubule and thus improve nephrogenic diabetes insipidus .",93.0,167.0,177.0,215.0
MedCaus," Some suggest that in children , bruxism may occasionally represent a response to earache or teething . ''",31.0,32.0,58.0,92.0
MedCaus," Study skins are dried in these positions to keep the end product as slender and streamlined as possible so large numbers of specimens can be stored side - by - side in flat file drawers , while occupying a minimum amount of space . ''",1.0,95.0,187.0,224.0
MedCaus," Simple filters made of darkened glass allow the full intensity of sunlight to pass through if they break , endangering the observer 's eyesight . ''",92.0,99.0,106.0,135.0
MedCaus," Accordingly , he could maintain actio vectigalis in rem against any one to recover possession of the land thus leased to him . ''",13.0,101.0,107.0,121.0
MedCaus," damage to DNA , and damage to tissues and cells by oxygen radicals -LRB- widely known as free radicals -RRB- , and some of this damage is not repaired and thus accumulates with time . ''",112.0,142.0,156.0,177.0
MedCaus," Pacik expanded the Lamont classification to include a fifth degree in which the patient experiences a visceral reaction such as sweating , hyperventilation , palpitations , trembling , shaking , nausea , vomiting , losing consciousness , wanting to jump off the table , or attacking the doctor . ''",1.0,26.0,42.0,287.0
MedCaus, Rumination is another possible response to threatening social information .,44.0,74.0,1.0,11.0
MedCaus," Today , inositol nitrate is used to gelatinize nitrocellulose , thus can be found in many modern explosives and solid rocket propellants . ''",7.0,47.0,65.0,125.0
MedCaus," If the cell tries to replicate crosslinked DNA during cell division , or tries to repair it , the DNA strands can break .",4.0,92.0,95.0,120.0
MedCaus, Secretion is regulated in this fashion so that proteins are not expelled into the extracellular matrix and elicit an immune response .,1.0,39.0,48.0,133.0
MedCaus, that serves to protect the brain from infection can become compromised allowing entry to pathogens .,1.0,71.0,81.0,99.0
MedCaus," an increase of protein -LRB- mRNA -RRB- stability , prolonging its existence and thus its activity in the cell ''",51.0,67.0,82.0,106.0
MedCaus, This will increase lithium reabsorption and its concentrations in the body .,1.0,5.0,20.0,75.0
MedCaus," The mastic villages are fortress - like , out of sight from the sea , surrounded by high walls and with no doors at street level -LRB- meaning that the villages were entered only by ladders -RRB- , in order to protect the sap from invaders .",1.0,196.0,211.0,240.0
MedCaus," Some schools of thought argue that speculators increase the liquidity in a market , and therefore promote an efficient market . ''",31.0,75.0,83.0,119.0
MedCaus," In these taxa , the oval head of the radius lies in front of the ulnar shaft so that the former overlaps the latter by half its width . ''",15.0,71.0,81.0,128.0
MedCaus, Kinesis -LRB- biology -RRB- is an animal 's non - directional movement activity in response to a stimulus .,96.0,106.0,51.0,80.0
MedCaus," By contrast , more sophisticated forms of humour such as satire require an understanding of its social meaning and context , and thus tend to appeal to a more mature audience . ''",13.0,115.0,130.0,166.0
MedCaus," A promising approach for ricin is to use the non - toxic B subunit -LRB- a lectin -RRB- as a vehicle for delivering antigens into cells , thus greatly increasing their immunogenicity .",38.0,136.0,144.0,183.0
MedCaus," In order to protect the developing science of modern chemistry from the negative censure of which alchemy was being subjected , academic writers during the scientific Enlightenment attempted , for the sake of survival , to divorce and separate the '' '' new '' '' chemistry from the '' '' old '' '' practices of alchemy . ''",284.0,293.0,10.0,116.0
MedCaus," The core is therefore shrinking , allowing the outer layers of the Sun to move closer to the centre and experience a stronger gravitational force , according to the inverse - square law . ''",13.0,22.0,33.0,140.0
MedCaus," Alloimmunity -LRB- sometimes called isoimmunity -RRB- is an immune response to nonself antigens from members of the same species , which are called alloantigens or isoantigens . ''",77.0,121.0,49.0,60.0
MedCaus," The dopamine transporter can no longer perform its reuptake function , and thus dopamine accumulates in the synaptic cleft . ''",1.0,60.0,76.0,117.0
MedCaus," When the Web developed in the 1990s , a typical web page was stored in completed form on a web server , formatted in HTML , complete for transmission to a web browser in response to a request .",183.0,192.0,138.0,167.0
MedCaus, The isomerase opens the ring : its His388 residue protonates the oxygen on the glucose ring -LRB- and thereby breaking the O5-C1 bond -RRB- in conjunction with Lys518 deprotonating the C1 hydroxyl oxygen .,32.0,92.0,111.0,204.0
MedCaus, These two impurities are thus removed by running an electromagnet over the mixture .,39.0,83.0,31.0,38.0
MedCaus," These balances are mostly genetically determined , but can be changed by body build , medications , food choices , and other factors .",74.0,133.0,52.0,70.0
MedCaus, Alkylating agents will work at any point in the cell cycle and thus are known as cell cycle - independent drugs .,1.0,59.0,69.0,112.0
MedCaus, Mattel lost the lawsuit and was forced to pay Forsythe 's legal costs .,1.0,24.0,29.0,70.0
MedCaus, The small board has a shirt pin on its back so it can be worn as a name badge .,48.0,78.0,1.0,44.0
MedCaus, This included limbs on the same side of the body thus including hemiplegia .,1.0,49.0,55.0,75.0
MedCaus," Ulrezaj traces Ramsey to Ehlna , breaking through the defenses of both the Protoss and the Dominion . ''",32.0,91.0,1.0,25.0
MedCaus," The producer may independently develop the '' '' concept '' '' or vision for a project or album , or develop the vision in collaboration with the artists and performers . ''",1.0,4.0,97.0,146.0
MedCaus," Fabric softeners impart antistatic properties to fabrics , and thus prevent the build - up of electrostatic charges on synthetic fibers , which in turn eliminates fabric cling during handling and wearing , crackling noises , and dust attraction . ''",1.0,49.0,224.0,234.0
MedCaus," In this scenario dissolved cocaine is soaked into a ball of cotton wool , which is placed in the nostril for the 10 ` Äì15 minutes immediately before the procedure , thus performing the dual role of both numbing the area to be cauterized , and vasoconstriction . ''",9.0,143.0,155.0,238.0
MedCaus," For example , chemotaxis in response to a sugar gradient has been observed in motile bacteria such as E. coli . ''",38.0,105.0,13.0,14.0
MedCaus," The plate was then coated with shellac to protect the moisture - vulnerable grains and dyes from the water - based gelatin emulsion , which was coated onto the plate after the shellac had dried . ''",108.0,123.0,1.0,31.0
MedCaus," Convincing the possessed Khalai to sever their cords and break away from the Khala , their action sends Amon 's essence into the artifact , which then implodes , banishing his essence into the Void . ''",84.0,151.0,161.0,193.0
MedCaus," Maggie asks Paul to help understand her creature , as it seemingly refuses to bond with Maggie . ''",52.0,88.0,1.0,40.0
MedCaus," Louder signals create a greater ' push ' on the Basilar membrane and thus stimulate more nerves , creating a stronger loudness signal .",1.0,65.0,75.0,134.0
MedCaus," In the balanced action system , a spring or hydraulic cylinder is used to balance the tension on the head so the pedal will stay in position and the head will stay at pitch . ''",1.0,101.0,107.0,167.0
MedCaus," Corruption , coupled with Trikoupis ' increased spending to fund infrastructure projects like the Corinth Canal , overtaxed the weak Greek economy and forced the declaration of public insolvency in 1893 .",1.0,36.0,49.0,203.0
MedCaus," The court said that if France did not adjust its agricultural and urbanization policies sufficiently to protect it , the government would be subject to fines of up to $ 24.6 million . ''",21.0,112.0,116.0,174.0
MedCaus," The hepatic artery also has both alpha - and beta - adrenergic receptors ; therefore , flow through the artery is controlled , in part , by the splanchnic nerves of the autonomic nervous system .",1.0,63.0,86.0,114.0
MedCaus," The terms '' '' intermediate '' '' , '' '' ipsilateral '' '' , '' '' contralateral '' '' , '' '' superficial '' '' , and '' '' deep '' '' , while indicating directions , are relative terms and thus do not properly define fixed anatomical axes . ''",118.0,127.0,136.0,174.0
MedCaus," In a cohort study of previously treated patients , ibrutinib induced responses in 91 % of patients , and at 2 years 69 % of patients had no progression of disease and 95 % were alive . ''",50.0,51.0,80.0,177.0
MedCaus," By the 920s , the situation had changed further , as North Africa was lost to the Abbasids .",54.0,91.0,1.0,48.0
MedCaus, Much of it goes into the bile and thus out into the small intestine .,1.0,30.0,40.0,68.0
MedCaus," An envelopment will consist of one or more enveloping forces , which attacks the enemy 's flank -LRB- s -RRB- , and a fixing force , which attacks the enemy 's front and '' '' fixes '' '' them in place so that they can not withdraw or shift their focus on the enveloping forces . ''",177.0,188.0,197.0,256.0
MedCaus," Larger and higher - velocity rain drops have greater kinetic energy , and thus their impact will displace soil particles by larger distances than smaller , slower - moving rain drops . ''",1.0,61.0,75.0,177.0
MedCaus," A range of mathematical models have been developed by relaxing the assumptions made in the Lotka - Volterra model ; these variously allow animals to have geographic distributions , or to migrate ; to have differences between individuals , such as sexes and an age structure , so that only some individuals reproduce ; to live in a varying environment , such as with changing seasons ; and analysing the interactions of more than just two species at once . ''",196.0,264.0,280.0,306.0
MedCaus, Glasses affect the position by changing the person 's reaction to focusing .,1.0,63.0,67.0,75.0
MedCaus," In Christianity , for example , Jesus is referred to as the '' '' Lamb of God '' '' , thus emphasizing his sinless nature . ''",31.0,74.0,82.0,103.0
MedCaus," Instead , certain types of porous media have been developed to kill microbes on contact . ''",9.0,50.0,51.0,80.0
MedCaus," They are dependent on replication inside the host cells , thus some species are termed obligate intracellular pathogens and others are symbionts of ubiquitous protozoa .",1.0,56.0,64.0,168.0
MedCaus, The heterogametic sex -LRB- males in humans -RRB- only receives one of each sex chromosome and will therefore show recessive trait even if they have only inherited one copy of a recessive allele .,1.0,91.0,111.0,136.0
MedCaus," This not only decreases the size of the rib cage , but also pushes the abdominal organs upwards against the diaphragm which consequently bulges deeply into the thorax .",61.0,118.0,138.0,167.0
MedCaus, That is why scientists are looking at immune targeting of these proteases to protect the infected host .,1.0,8.0,13.0,103.0
MedCaus, Penile fixation permanently attaches the penis to the abdomen so that it can not be lowered for penetration .,1.0,62.0,71.0,108.0
MedCaus," Iran ` Äôs literacy programs were among the most innovative and effective anywhere in the world , so that by 1977 the number of Iranians able to read and write had climbed from just 17 percent to more than 50 percent . ''",1.0,90.0,102.0,209.0
MedCaus," At the exact midpoint between the two pKa values , the trace amount of net negative and trace of net positive ions exactly balance , so that average net charge of all forms present is zero . ''",50.0,131.0,134.0,184.0
MedCaus," There is a linear relationship between them however , so these coordinates can be made homogeneous by allowing multiples of -LRB- X , Y , Z -RRB- to represent the same point . ''",1.0,39.0,141.0,168.0
MedCaus, They can outgrow and thus outcompete corals on bare surfaces .,1.0,17.0,27.0,61.0
